Title,Authors,Pubhouse,NewPrice,OldPrice,Discount
Методы восстановления непараметрической регрессии в условиях несбалансированных данных. Монография,"Пылов Петр Андреевич, Дягилева Анна Владимировна, Майтак Роман Вячеславович",Инфра-Инженерия,992,1 803,45
Азбука программирования игр в UNITY 3D,Рубочкин Владимир,Солон-пресс,615,1 118,45
C++ для начинающих,Шилдт Герберт,Питер : Библиотека программиста,1 812,2 323,22
"Знакомьтесь, Python. Секреты профессии",Павлов Евгений Иванович,АСТ : Программирование для всех,624,1 040,40
"Конфигурирование и моделирование в системе ""1С: Предприятие"". Учебник",Дадян Эдуард Григорьевич,ИНФРА-М : Высшее образование. Магистратура,5 161,Нет старой цены,Ошибка
Бизнес-разведка 2.2 + OSINT,Доронин Александр Иванович,ДМК-Пресс,2 456,4 466,45
Эволюционное глубокое обучение. Генетические алгоритмыи нейронные сети,Лэнхэм Майкл,ДМК-Пресс,3 071,5 583,45
ESP32-C3. Беспроводное приключение. Полное руководство по IoT,Не указан автор,ДМК-Пресс,2 456,4 466,45
Linux для сетевых инженеров,Ванденбринк Роб,Питер : Библиотека программиста,2 183,2 799,22
Практикум. Демонстрационный экзамен базового уровня. Сетевое и системное администрирование. СПО,Уймин Антон Григорьевич,Лань : Компьютеры и программное обеспечение,1 669,3 035,45
Программная инженерия. Интеграционный подход к разработке. Учебник,"Турнецкая Елена Леонидовна, Аграновский Андрей Владимирович",Лань : Компьютеры и программное обеспечение,1 882,3 422,45
Моделирование информационных систем. Unified Modeling Language. Учебное пособие для вузов,Не указан автор,Лань : Компьютеры и программное обеспечение,872,1 585,45
Ошибки разработчиков видеоигр. От идеи до провала,Грис Слава,АСТ : Видеоигры: глубокое погружение,587,979,40
Искусство Agile-разработки. Теория и практика гибкой разработки ПО,"Шор Джеймс, Уорден Шэйн",Питер : Бестселлеры O`Reilly,2 719,3 486,22
Производство программ. Инженерный подход. Монография,"Охтилев Михаил Юрьевич, Коромысличенко Владислав Николаевич, Охтилев Павел Алексеевич",Инфра-Инженерия,921,1 675,45
BLAZOR в действии,Сэйнти Крис,Солон-пресс,2 456,4 466,45
Сверхбыстрый Python. Эффективные техники для работы с большими наборами данных,Антао Тиаго,ДМК-Пресс,2 764,5 026,45
Грокаем функциональное программирование,Плахта Михаил,Питер : Библиотека программиста,2 410,3 090,22
Информационная безопасность. Защита и нападение,Бирюков Андрей Александрович,ДМК-Пресс,2 303,4 187,45
"Язык C. Мастерство программирования. Принципы, практики и паттерны",Прешерн Кристофер,ДМК-Пресс,2 303,4 187,45
"Java. устранение проблем. Чтение, отладка и оптимизация JVM-приложений",Спилкэ Лауренциу,ДМК-Пресс,2 303,4 187,45
Архитектура встраиваемых систем,Лакамера Даниэле,ДМК-Пресс,2 303,4 187,45
"Проектирование в Платформе nanoCAD с модулями ""механика"" и ""3D"". Учебное пособие",Кувшинов Николай Сергеевич,ДМК-Пресс,1 536,2 793,45
100 ошибок Go и как их избежать,Харшани Тейва,Питер : Для профессионалов,3 334,4 274,22
"Golang для профи. Создаем профессиональные утилиты, параллельные серверы и сервисы",Цукалос Михалис,Питер : Для профессионалов,4 427,5 676,22
Машинное зрение. Основы и алгоритмы с примерами на Matlab,Корк Питер,ДМК-Пресс,3 838,6 979,45
Изучаем RAY. Гибкие распределенные вычисления на Python в машинном обучении,"Пумперла Макс, Оукс Эдвард, Ляо Ричард",ДМК-Пресс,2 149,3 908,45
Основы объектно-ориентированного программирования на базе языка С#. Учебное пособие,Залогова Любовь Алексеевна,Лань : Учебники для вузов. Специальная литература,1 356,2 466,45
Как создаются игры. Основы разработки для начинающих игроделов,"Радовильский Григорий, Андрианова Наталья Аркадьевна",Бомбора : Российский компьютерный бестселлер,1 037,1 596,35
Разработка SCADA-систем. Учебное пособие,"Кангин Владимир Венедиктович, Кангин Михаил Владимирович, Ямолдинов Дмитрий Николаевич",Инфра-Инженерия,1 752,3 186,45
PHP и MYSQL. Серверная веб-разработка,Дакетт Джон,Бомбора : Мировой компьютерный бестселлер,2 387,3 672,35
Прикладные структуры данных и алгоритмы. Прокачиваем навыки,Венгроу Джей,Питер : Библиотека программиста,2 173,2 786,22
Pyomo. Моделирование оптимизации на Python,"Бинум Майкл Л., Харт Уильям, Хакебейл Габриэль А.",ДМК-Пресс,1 842,3 349,45
Системное программирование,Бизянов Евгений Евгеньевич,Инфра-Инженерия,751,1 366,45
Python. Лучшие практики и инструменты,"Яворски Михал, Зиаде Тарек",Питер : Для профессионалов,3 156,4 046,22
Изучаем vi и Vim. Не просто редакторы,"Роббинс Арнольд, Ханна Элберт",Питер : Библиотека программиста,2 069,2 653,22
Основы вычислений и программирования в пакете MathCAD PRIME. Учебное,"Воскобойников Юрий Евгеньевич, Задорожный Анатолий Филиппович",Лань : Учебники для вузов. Специальная литература,1 953,3 550,45
Современные подходы в программировании при создании интерактивной анимации на С# и Unity,Курбанисмаилов Заур Магомедович,Лань : Компьютеры и программное обеспечение,1 812,3 294,45
"Clojure на производстве. Зипперы, базы данных, REPL",Гришаев Иван,ДМК-Пресс,2 149,3 908,45
Проектирование информационных систем. Основы управления проектами. Лабораторный практикум,"Баллод Борис Анатольевич, Гвоздева Татьяна Вадимовна",Лань : Компьютеры и программное обеспечение,768,1 397,45
Компьютерная геометрия и графика в web-разработке. Учебное пособие для СПО,Васильев Николай Павлович,Лань : Компьютеры и программное обеспечение,1 183,2 150,45
Создание игровой логики. Практикум,"Капанов Алексей Александрович, Лямин Александр Сергеевич",Лань : Компьютеры и программное обеспечение,465,845,45
Компьютерное моделирование химико-технологических процессов в программе Aspen Plus,"Перерва Олег Валентинович, Гартман Томаш Николаевич",Лань : Компьютеры и программное обеспечение,2 819,5 126,45
Создание игровой логики. Практикум,"Капанов Алексей Александрович, Лямин Александр Сергеевич",Лань : Компьютеры и программное обеспечение,465,845,45
Компьютерная геометрия и графика в web-разработке. Учебное пособие,Васильев Николай Павлович,Лань : Компьютеры и программное обеспечение,1 359,2 471,45
Разработка защищенных программных средств информатизации производственных процессов предприятия,"Бабушкин Виталий Михайлович, Тумбинская Марина Владимировна",Инфра-Инженерия,1 252,2 276,45
Современный подход к программной архитектуре. Сложные компромиссы,"Ричардс Марк, Форд Нил, Дехгани Жамак",Питер : Для профессионалов,3 047,3 906,22
OpenSSL 3. Ключ к тайнам криптографии,Хлебников Алексей,ДМК-Пресс,2 303,4 187,45
Julia в качестве второго языка,Энгхейм Эрик,ДМК-Пресс,2 918,5 306,45
Защита и укрепление Linux,Треволт Дональд А.,ДМК-Пресс,3 071,5 583,45
JavaScript. Рецепты для разработчиков,"Скотт Адам Д., Пауэрс Шелли, Макдоналд Мэтью",Питер : Бестселлеры O`Reilly,1 955,2 506,22
Искусство чистого кода. Как избавиться от сложности и упростить жизнь,Майер Кристиан,Питер : Библиотека программиста,1 412,1 810,22
Микросервисы. От архитектуры до релиза,"Митра Ронни, Надареишвили Иракли",Питер : Бестселлеры O`Reilly,1 633,2 093,22
"97 вещей, о которых должен знать каждый Java-программист","Хенни Кевлин, Триша Джи",Бомбора : Мировой компьютерный бестселлер,902,1 388,35
Безопасность веб-приложений. Исчерпывающий гид для начинающих разработчиков,Янка Таня,Бомбора : КиберБез. Лучшие книги о безопасности в сети,995,1 530,35
Линейное программирование. Часть 1. Учебное пособие для бакалавриата,Шандра Игорь Георгиевич,Прометей,518,941,45
Level up! Руководство по созданию классных видеоигр,Роджерс Скотт,Бомбора : Мировой компьютерный бестселлер,1 334,2 053,35
Современный С++. Безопасное использование,"Лакос Джон, Хлебников Ростислав, Мередит Алисдар",ДМК-Пресс,4 146,7 539,45
Модернизация Java Enterprise. Облачные технологии для разработчиков,"Эйзеле Маркус, Винто Натале",Питер : Бестселлеры O`Reilly,2 114,2 710,22
Практикум по информатике. Основы алгоритмизации и программирования,Колокольникова Алла Ивановна,Директмедиа Паблишинг,1 202,2 186,45
Введение в теорию языков программирования,"Довек Жиль, Леви Жан-Жак",ДМК-Пресс,613,1 115,45
Spring в действии,Уоллс Крейг,ДМК-Пресс : Программирование в действии,1 919,3 489,45
Программирование на языке OCaml,"Мински Ярон, Мадхавапедди Анил, Хикки Джейсон",ДМК-Пресс : Функциональное программирование,1 536,2 793,45
CUDA Fortran для инженеров и научных работников. Рекомендации по эффективному программированию,"Рутш Грегори, Фатика Массимилиано",ДМК-Пресс,921,1 674,45
Платформа Windows Azure,"Редкар Теджасви, Тони Гвидичи",ДМК-Пресс,1 228,2 233,45
"За пределами ""Linux с нуля"". Версия 7.4. Том 2",Не указан автор,ДМК-Пресс,1 228,2 233,45
.NET Сетевое программирование,"Кумар Винод, Кровчик Эндрю, Лагари Номан",Лори,962,1 749,45
Моделирование электротехнических устройств в MATLAB. SimPowerSystems и Simulink,Черных Илья Викторович,ДМК-Пресс : Проектирование,613,1 115,45
Java. Эффективное программирование,Блох Джошуа,Лори,1 421,2 584,45
Разработка веб-приложений с использованием AngularJS,"Козловский Павел, Бэкон Дарвин Питер",ДМК-Пресс,997,1 813,45
LabVIEW. Практический курс для инженеров и разработчиков,Магда Юрий Степанович,ДМК-Пресс : Все о LabVIEW,767,1 395,45
"Принципы построения, применения и проектирования компьютерной платформы U-SYS","Росляков Александр Владимирович, Крылов Павел Сергеевич",Солон-пресс : Библиотека студента,245,445,45
Разработка приложений Java EE 6 в NetBeans 7,Хеффельфингер Дэвид,ДМК-Пресс,921,1 674,45
Курс практического программирования в Delphi. Объектно – ориентированное программирование. Практикум,Санников Е. В.,Солон-пресс : Элективный курс. Профильное обучение,641,1 165,45
C++ AMP. Построение массивно параллельных программ с помощью Microsoft Visual C++,"Грегори Кейт, Миллер Эйд",ДМК-Пресс,1 074,1 953,45
Оптимизация производительности приложений для iOS. Для профессионалов,Во Ханг,ДМК-Пресс,704,1 280,45
Структуры данных и алгоритмы в Java. Классика Computers Science,Лафоре Роберт,Питер : Классика computer science,2 830,3 628,22
"Звуковой дизайн в видеоиграх. Технология ""игрового"" аудио для непрограммистов",Деникин Антон Анатольевич,ДМК-Пресс,1 688,3 069,45
Создание web-приложений в Silverlight,Буньон Лоран,ДМК-Пресс,573,1 042,45
С++ для начинающих,Шилдт Герберт,Эком : Шаг за шагом,1 178,2 142,45
Профессиональное программирование приложений для iPhone и iPad,Баклин Джин,Эксмо : Мировой компьютерный бестселлер,1 010,1 384,27
Silverlight. Практическое руководство,Браун Пит,Питер,1 399,1 793,22
PHP. Создание динамических страниц,Пауэрс Дэвид,Рид Групп : Веб-технологии,933,1 555,40
Изучаем Java,"Сьерра Кэтти, Бейтс Берт",Эксмо : Мировой компьютерный бестселлер,1 496,2 302,35
1С: Предприятие 8.2. Коротко о главном. Новые возможности версии 8.2 (+CD),Радченко Максим Григорьевич,1С : 1С: Предприятие 8.2,191,347,45
"Как настраивать ""1С: Предприятие 8.2"" при внедрении +СD",Ажеронок Валентин Александрович,1С : 1С: Предприятие 8.2,185,336,45
Macromedia Authorware 6.0. Разработка мультимедийных учебных курсов,Гультяев Алексей Константинович,Корона-Принт,228,414,45
Руководство разработчика по Microsoft Enterprise Library,"Хоумер Алекс, Ботто Николас, Мельник Григорий",Эком,516,938,45
Groovy и Grails. Практические советы,Абдул-Джавад Башар,ДМК-Пресс,2 559,4 652,45
Микрокомпьютерные системы управления. Первое знакомство,Суэмацу Есикадзу,Додека XXI век,1 382,2 513,45
Silverlight 2. Технология создания интернет-приложений,Буньон Лоран,ДМК-Пресс,460,837,45
Численные методы безусловной оптимизации,Не указан автор,Инфра-Инженерия,1 222,2 221,45
Python. Сборник упражнений,Стивенсон Бен,ДМК-Пресс,1 074,1 953,45
"Стильный Java. Код, который работает всегда и везде",Фаэлла Марко,Питер : Библиотека программиста,2 430,3 116,22
Карьера программиста,Лакман Макдауэлл Гейл,Питер : Библиотека программиста,2 127,2 727,22
Глубокое обучение. Легкая разработка проектов на Python,Вейдман Сет,Питер : Бестселлеры O`Reilly,2 901,3 719,22
Структуры и алгоритмы обработки данных. Учебник для СПО,"Павлов Леонид Александрович, Первова Наталия Викторовна",Лань : Компьютеры и программное обеспечение,1 210,2 200,45
Численные методы и программирование. Учебное пособие для СПО,Слабнов Виктор Дмитриевич,Лань : Компьютеры и программное обеспечение,3 397,6 176,45
Технология разработки программного обеспечения. Учебное пособие для СПО,Зубкова Татьяна Михайловна,Лань : Компьютеры и программное обеспечение,2 308,4 196,45
Изучаем C++ через программирование игр,Доусон Майкл,Питер,1 119,1 399,20
Совершенный софт. Совершенный софт - совершенная карьера,Леве Джувел,Питер : Для профессионалов,2 214,2 839,22
"Spark в действии. С примерами Java, Python и Scala",Перрен Жан-Жорж,ДМК-Пресс,3 071,5 583,45
Изучаем Power Query. Наглядный подход к подключению и преобразованию данных из множества источников,"Фоукс Линда, Спарроу Уоррен",ДМК-Пресс,1 995,3 628,45
Моделирование и оптимизация процессов управления в технологических системах. Учебник,"Колтунов Игорь Ильич, Крыжановская Татьяна Георгиевна",Кнорус : Магистратура,1 005,1 828,45
Квантовые вычисления. Прикладной подход,Хидари Джек Д.,ДМК-Пресс,1 842,3 349,45
JavaScript. Полное руководство,Флэнаган Дэвид,Вильямс,4 436,8 066,45
Проектирование информационных систем. Методы и средства структурно-функционального проектирования,"Гвоздева Татьяна Вадимовна, Баллод Борис Анатольевич",Лань : Компьютеры и программное обеспечение,1 101,2 001,45
Структуры дан.в C#.Лин.и нелин.динамич.структ.СПО,Симонова Елена Витальевна,Лань : Компьютеры и программное обеспечение,1 173,2 133,45
"Проектирование информационных систем. Стандартизация, техническое документирование информ. систем","Гвоздева Татьяна Вадимовна, Баллод Борис Анатольевич",Лань : Компьютеры и программное обеспечение,1 445,2 628,45
Системы отображения информации. Дискретные индикаторы. Учебник для вузов,Смирнов Виктор Михайлович,Лань : Компьютеры и программное обеспечение,2 246,4 083,45
"Инфокоммуникационные системы. Протоколы,интерфейсы. Практикум. СПО",Журавлев Антон Евгеньевич,Лань : Компьютеры и программное обеспечение,1 890,3 436,45
Нечеткое моделирование и управление в технических системах. Учебное пособие для вузов,"Кудинов Юрий Иванович, Пащенко Федор Федорович, Пащенко Александр Федорович",Лань : Компьютеры и программное обеспечение,2 041,3 710,45
"Swift. Основы разработки приложений под iOS, iPadOS и macOS",Усов Василий,Питер : Библиотека программиста,2 116,2 713,22
Система модулей Java,Парлог Николай,Питер : Для профессионалов,2 558,3 279,22
Игровой движок. Программирование и внутреннее устройство,Грегори Джейсон,Питер : Для профессионалов,5 460,7 000,22
Принципы юнит-тестирования,Хориков Владимир,Питер : Для профессионалов,1 413,1 811,22
Простой Python. Современный стиль программирования,Любанович Билл,Питер : Бестселлеры O`Reilly,2 619,Нет старой цены,Ошибка
Kotlin. Сборник рецептов. Предметный подход,Коузен Кен,ДМК-Пресс,1 536,2 793,45
Олимпиадное программирование,Лааксонен Антти,ДМК-Пресс,1 612,2 930,45
Алгоритмы и структуры данных. Учебное пособие,Мясникова Нелли Александровна,Кнорус : Бакалавриат,1 118,2 032,45
Компьютерная арифметика. Учебное пособие. СПО (+CD),Иорданский Михаил Анатольевич,Лань : Компьютеры и программное обеспечение,1 023,1 860,45
Программирование. Практикум. Учебное пособие,Быкадорова Елена Анатольевна,Лань : Компьютеры и программное обеспечение,475,864,45
